{
  "schema": "shiin.test-vector/v1-draft.1",
  "id": "TV-002",
  "name": "A denied read of a secret",
  "action_request": {
    "schema": "shiin.action-request/v1-draft.1",
    "id": "0190f3a0-1c2d-4e3f-8a4b-5c6d7e8f9a0c",
    "session": "sess-001",
    "agent": {
      "id": "agent-001",
      "assurance": "asserted"
    },
    "action_type": "fs.read",
    "effects": [
      {
        "kind": "path",
        "value": "/home/dev/project/.env",
        "confidence": "exact"
      }
    ],
    "task": null,
    "policy_snapshot": "sha256:bbbbbbbbbbbbbbbbbbbbbbbbbbbbbbbbbbbbbbbbbbbbbbbbbbbbbbbbbbbbbbbb",
    "host": {
      "name": "claude-code",
      "tool": "Read"
    },
    "workspace": {
      "root": "/home/dev/project",
      "vcs": "git"
    }
  },
  "policy": {
    "schema": "shiin.policy/v1-draft.1",
    "layers": [
      {
        "name": "user",
        "digest": "sha256:bbbbbbbbbbbbbbbbbbbbbbbbbbbbbbbbbbbbbbbbbbbbbbbbbbbbbbbbbbbbbbbb",
        "rules": [
          {
            "id": "no-secrets",
            "effect": "deny",
            "action_types": [
              "fs.read"
            ],
            "resources": [
              "**/.env",
              "**/.env.*",
              "~/.ssh/**"
            ],
            "reason": "Secret files are not readable by agents."
          }
        ]
      }
    ],
    "default": "deny"
  },
  "expected": {
    "decision": "deny",
    "reason": "deny.policy"
  }
}
