{
  "schema": "shiin.test-vector/v1-draft.1",
  "id": "TV-005",
  "name": "A bulk deletion",
  "action_request": {
    "schema": "shiin.action-request/v1-draft.1",
    "id": "0190f3a0-1c2d-4e3f-8a4b-5c6d7e8f9a0f",
    "session": "sess-001",
    "agent": {
      "id": "agent-001",
      "assurance": "asserted"
    },
    "action_type": "fs.delete",
    "effects": [
      {
        "kind": "path",
        "value": "/home/dev/project/old-outputs",
        "confidence": "exact"
      },
      {
        "kind": "count",
        "value": "50",
        "confidence": "exact"
      }
    ],
    "task": null,
    "policy_snapshot": "sha256:eeeeeeeeeeeeeeeeeeeeeeeeeeeeeeeeeeeeeeeeeeeeeeeeeeeeeeeeeeeeeeee",
    "host": {
      "name": "claude-code",
      "tool": "Bash"
    },
    "workspace": {
      "root": "/home/dev/project",
      "vcs": "git"
    }
  },
  "policy": {
    "capabilities": {"EXAMPLE-corpus": {"id": "EXAMPLE-corpus", "allow": true, "action_types": ["*"]}},
    "schema": "shiin.policy/v1-draft.2",
    "layers": [
      {
        "name": "user",
        "digest": "sha256:eeeeeeeeeeeeeeeeeeeeeeeeeeeeeeeeeeeeeeeeeeeeeeeeeeeeeeeeeeeeeeee",
        "rules": [
          {
            "id": "allow-deletes",
            "effect": "allow",
            "action_types": [
              "fs.delete"
            ],
            "resources": [
              "./old-outputs/**"
            ]
          }
        ]
      }
    ],
    "default": "deny",
    "risk": {
      "bulk_delete": {
        "decision": "pending",
        "threshold": 20
      }
    }
  },
  "expected": {
    "decision": "pending",
    "reason": "pending.risk"
  }
}
