{
  "schema": "shiin.test-vector/v1-draft.1",
  "id": "TV-023",
  "name": "A capability alone cannot authorize",
  "action_request": {
    "schema": "shiin.action-request/v1-draft.1",
    "id": "0190f3a0-1c2d-4e3f-8a4b-5c6d7e8f9a0b",
    "session": "sess-001",
    "agent": {
      "id": "agent-001",
      "assurance": "asserted"
    },
    "action_type": "fs.write",
    "effects": [
      {
        "kind": "path",
        "value": "/home/dev/project/src/login.rs",
        "confidence": "exact"
      }
    ],
    "task": null,
    "policy_snapshot": "sha256:aaaaaaaaaaaaaaaaaaaaaaaaaaaaaaaaaaaaaaaaaaaaaaaaaaaaaaaaaaaaaaaa",
    "host": {
      "name": "claude-code",
      "tool": "Write"
    },
    "workspace": {
      "root": "/home/dev/project",
      "vcs": "git"
    }
  },
  "policy": {
    "capabilities": {
      "EXAMPLE-corpus": {
        "id": "EXAMPLE-corpus",
        "allow": true,
        "action_types": [
          "*"
        ]
      }
    },
    "schema": "shiin.policy/v1-draft.2",
    "layers": [
      {
        "name": "user",
        "digest": "sha256:aaaaaaaaaaaaaaaaaaaaaaaaaaaaaaaaaaaaaaaaaaaaaaaaaaaaaaaaaaaaaaaa",
        "rules": []
      }
    ],
    "default": "deny"
  },
  "expected": {
    "decision": "deny",
    "reason": "deny.default"
  }
}
